<?xml version="1.0" encoding="utf-8" ?>
<World
  xmlns="http://eaket.com/games/dragonfly/WorldSchema1"
  xmlns:xsi="http://www.w3.org/2001/XMLSchema-instance"
  xsi:schemaLocation="http://eaket.com/games/dragonfly/WorldSchema1 WorldSchema1.xsd">
  <WorldInfo 
    Name="Test Level 1"
    Description="This is the first level to be loaded"
    Language="en"/>
  <PhysicsSettings>
    <Gravity X="0" Y="0"/>
  </PhysicsSettings>
  <WorldElements>
    <RectangleElement Color="#ff0000">
      <Position X="20" Y="20"/>
      <Body BodyType="Dynamic" Mass="1"/>
      <Size X="10" Y="10"/>
    </RectangleElement>
    <RectangleElement Color="#00ff00">
      <Position X="100" Y="200"/>
      <Body BodyType="Static" Mass="1"/>
      <Size X="200" Y="5"/>
    </RectangleElement>
  </WorldElements>
</World>